"Measure","Current care (2020)","Current care (2040)","Targeted (2040)","Population (2040)","Current care (2045)","Targeted (2045)","Population (2045)","Current care (2050)","Targeted (2050)","Population (2050)"
"New CVD events (millions)",40,77,74,72,89,84,81,100,94,91
"CVD events averted (millions)",NA,NA,3,5.6,NA,4.7,8.1,NA,6.9,11
"Change in CVD events (%)",NA,NA,4,7.8,NA,5.6,10,NA,7.3,12
"Prevalent CVD cases (millions)",310,540,540,530,600,590,590,660,650,640
"Change in CVD prevalence (%)",NA,NA,0.88,2,NA,1.3,2.9,NA,1.8,3.3
"CVD deaths (millions)",16,31,30,29,36,34,33,41,39,37
"CVD deaths averted (millions)",NA,NA,1.2,2.2,NA,1.9,3.3,NA,2.9,4.4
"Change in CVD deaths (%)",NA,NA,4,7.7,NA,5.7,10,NA,7.4,12
